{
  "_schema": "EXOCHRONOS_STATE",
  "_version": "1.0",
  "_date": "2026-06-07",
  "_claim_ceiling": "LOCAL_ONLY__NO_EXTERNAL_PROOF",

  "convergence": {
    "verdict": "CONVERGENCE_DETECTED",
    "independent_audits_agree_on_bottleneck": true,
    "convergence_on_bottleneck": "SUPPORTED",
    "convergence_on_claims_validity": "NOT_TESTED",
    "basis": [
      "Internal repo audit (gpts_core, tests, coverage, traceability)",
      "External document audit (NEXT-01, NEXT-03, NEXT-04, packet C01-C08)"
    ]
  },

  "component_status": {
    "core_deterministic_framework": "READY",
    "governance_framework": "READY",
    "promotion_engine": "READY",
    "krippendorff_engine": "READY",
    "blindness_verifier": "READY",
    "replication_infrastructure": "READY",
    "external_replication": "NOT_STARTED",
    "real_auditor_classifications": "MISSING"
  },

  "gap_assessment": {
    "technical_gap": "LOW",
    "data_gap": "HIGH"
  },

  "repo_metrics": {
    "coverage_omniagis": "99%",
    "coverage_omniagis_tests": 354,
    "coverage_gpts_core": "65%",
    "coverage_gpts_core_tests": 114,
    "equivalence_tests": 21,
    "equivalence_pass": 21,
    "traceability_symbols": 105,
    "unexplained_deltas": 0
  },

  "packet": {
    "id": "C01-C08",
    "packet_hash": "664a8690783af4ce62a72e80e08a50429d86e65b9645b91ae185084c309d1013",
    "frozen": true,
    "canonical": false,
    "requires_owner_confirmation": true,
    "canonical_status": "CANDIDATE__AWAITING_OWNER_DECISION"
  },

  "owner_decision_point": {
    "option_a": "Confirm packet C01-C08 as CANONICAL_v1 → proceed to real data collection immediately",
    "option_b": "Modify claims → regenerate packet hash → then proceed to real data collection",
    "decision_criterion": "Does a concrete reason exist to believe any claim is ambiguous, biased, non-discriminant, or difficult to audit?",
    "rational_default": "OPTION_A if no concrete reason found — first dataset reveals more than further theoretical refinement"
  },

  "next_phase": {
    "gate": "OWNER_PACKET_DECISION",
    "next_artifact": "classification_matrix_real_v1.json",
    "next_metric": "real_krippendorff_alpha",
    "pipeline": [
      "OWNER_CONFIRMS_PACKET → CANONICAL_v1",
      "AUDITORS_CLASSIFY(HUMAN_01, HUMAN_02, GPT, CLAUDE, GROK) on C01-C08",
      "classification_matrix_real_v1.json produced",
      "Krippendorff α computed",
      "C08_GATE evaluated",
      "META_AUDIT",
      "REPLICATION_REVIEW",
      "VERDICT"
    ],
    "blocked_until": "real_auditor_classifications"
  },

  "axioms": {
    "AX-01": "CLAIM ≤ EVIDENCE",
    "AX-02": "REPLICATION > CONFIDENCE",
    "AX-03": "FAIL_CLOSED WINS"
  },

  "blocked_claims": [
    "absolute_zero_loss",
    "universal_exhaustivity",
    "external_scientific_validation",
    "production_ready_unqualified"
  ],

  "allowed_claims": [
    "omniagis_coverage_99pct__SUPPORTED",
    "gpts_core_coverage_65pct__SUPPORTED",
    "functional_reconstruction_within_audited_scope__SUPPORTED_WITHIN_SCOPE",
    "traceability_4_primary_sources__SUPPORTED_WITHIN_SCOPE",
    "equivalence_math_functions_21_tests__SUPPORTED_WITHIN_SCOPE",
    "zero_observable_loss_in_audited_scope__SUPPORTED_WITHIN_SCOPE"
  ]
}
